{
    "$schema": "https://raw.githubusercontent.com/marlanperumal/pdf_statement_reader/develop/pdf_statement_reader/config/psr_config.schema.json",
    "layout": {
        "default": {
            "area": [183, 78, 731, 530],
            "columns": [120, 289, 290, 330, 350, 415, 475, 530]
        },
        "first": {
            "area": [419, 78, 731, 530],
            "columns": [120, 289, 290, 330, 350, 415, 475, 530]
        }
    },
    "columns": {
        "trans_date": "Date",
        "trans_type": "Transaction Description",
        "trans_detail": "Transaction Detail",
        "charge": "Charge",
        "charge_type": "Charge Type",
        "debit": "Debit Amount",
        "credit": "Credit Amount",
        "balance": "Balance"
    },
    "order": [
        "trans_date",
        "trans_type",
        "trans_detail",
        "charge",
        "charge_type",
        "debit",
        "credit",
        "balance"
    ],
    "cleaning": {
        "numeric": ["charge", "debit", "credit", "balance"],
        "date": ["trans_date"],
        "date_format": "%d/%m/%Y",
        "trans_detail": "below",
        "dropna": ["balance"]
    }
}